<?xml version="1.0" encoding="UTF-8"?>
<supportsystem xmlns:xsi="http://www.w3.org/2001/XMLSchema-instance" xsi:noNamespaceSchemaLocation="../schema/supportsystem.xsd">
    <supportticket category="Software">
        <ticketnumber>A100</ticketnumber>
        <issuedate>2018-01-28</issuedate>
        <status>On-going</status>
        <clientid>986</clientid>
        <supportmessages>
            <supportmessage userid="986">
                <message>Installation failed</message>
                <time>2017-12-28T11:00:00</time>
            </supportmessage>
        </supportmessages>
    </supportticket>
    <supportticket category="Hardware">
        <ticketnumber>A101</ticketnumber>
        <issuedate>2018-02-16</issuedate>
        <status>On-going</status>
        <clientid>465</clientid>
        <supportmessages>
            <supportmessage userid="465">
                <message>Wi-fi not working.</message>
                <time>2018-01-30T09:00:00</time>
            </supportmessage>
        </supportmessages>
    </supportticket>
    <supportticket category="Software">
        <ticketnumber>A104</ticketnumber>
        <issuedate>2018-01-16</issuedate>
        <status>Resolved</status>
        <clientid>465</clientid>
        <supportmessages>
            <supportmessage userid="465">
                <message>Needs more RAM space</message>
                <time>2018-02-16T09:00:00</time>
            </supportmessage>
            <supportmessage userid="289">
                <message>RAM space added</message>
                <time>2018-02-17T09:00:00</time>
            </supportmessage>
        </supportmessages>
    </supportticket>
    <supportticket category="Software">
        <ticketnumber>A108</ticketnumber>
        <issuedate>2018-02-25</issuedate>
        <status>Resolved</status>
        <clientid>234</clientid>
        <supportmessages>
            <supportmessage userid="234">
                <message>Needs permission for further work.</message>
                <time>2018-02-20T12:30:00</time>
            </supportmessage>
            <supportmessage userid="289">
                <message>Permission granted</message>
                <time>2018-02-20T12:30:00</time>
            </supportmessage>
        </supportmessages>
    </supportticket>
<supportticket category="Hardware"><ticketnumber>A105</ticketnumber><issuedate>2018-03-14</issuedate><status>New</status><clientid>234</clientid><supportmessages><supportmessage userid="234"><message>Computer shut down.</message><time>2018-03-30 01:22:07</time></supportmessage></supportmessages></supportticket><supportticket category="Software"><ticketnumber>A300</ticketnumber><issuedate>2018-03-29</issuedate><status>New</status><clientid>234</clientid><supportmessages><supportmessage userid="234"><message>New software required</message><time>2018-03-30 01:22:36</time></supportmessage></supportmessages></supportticket></supportsystem>
